{
  "measurement_session_id": "2026-02-01_morning",
  "subject_profile_id": "subject_default",
  "measured_at": "2026-02-01T08:05:00",
  "source_type": "manual_entry",
  "source_quality": "measured_direct",
  "context_time_of_day": "morning",
  "fasting_state": true,
  "before_training": true,
  "notes": "Second check after three training weeks.",
  "measurements": [
    {"order_in_session": 1, "measurement_type_raw": "обхват плеч", "value_numeric": 123.5, "unit": "cm", "raw_value": "123.5 см", "notes": null},
    {"order_in_session": 2, "measurement_type_raw": "шея", "value_numeric": 41.0, "unit": "cm", "raw_value": "41 см", "notes": null},
    {"order_in_session": 3, "measurement_type_raw": "грудная клетка", "value_numeric": 110.0, "unit": "cm", "raw_value": "110 см", "notes": null},
    {"order_in_session": 4, "measurement_type_raw": "обхват талии", "value_numeric": 95.5, "unit": "cm", "raw_value": "95.5 см", "notes": null},
    {"order_in_session": 5, "measurement_type_raw": "бедра", "value_numeric": 103.0, "unit": "cm", "raw_value": "103 см", "notes": null},
    {"order_in_session": 6, "measurement_type_raw": "бедро", "value_numeric": 62.5, "unit": "cm", "raw_value": "62.5 см", "notes": null},
    {"order_in_session": 7, "measurement_type_raw": "икроножная", "value_numeric": 39.8, "unit": "cm", "raw_value": "39.8 см", "notes": null},
    {"order_in_session": 8, "measurement_type_raw": "бицепс", "value_numeric": 37.2, "unit": "cm", "raw_value": "37.2 см", "notes": null},
    {"order_in_session": 9, "measurement_type_raw": "предплечье", "value_numeric": 30.8, "unit": "cm", "raw_value": "30.8 см", "notes": null},
    {"order_in_session": 10, "measurement_type_raw": "масса тела", "value_numeric": 94.8, "unit": "kg", "raw_value": "94.8 кг", "notes": null}
  ]
}
