{
  "measurement_session_id": "2026-02-22_morning",
  "subject_profile_id": "subject_default",
  "measured_at": "2026-02-22T08:20:00",
  "source_type": "manual_entry",
  "source_quality": "measured_direct",
  "context_time_of_day": "morning",
  "fasting_state": true,
  "before_training": false,
  "notes": "Measured on a rest morning before breakfast.",
  "measurements": [
    {"order_in_session": 1, "measurement_type_raw": "плечи", "value_numeric": 123.0, "unit": "cm", "raw_value": "123 см", "notes": null},
    {"order_in_session": 2, "measurement_type_raw": "обхват шеи", "value_numeric": 40.8, "unit": "cm", "raw_value": "40.8 см", "notes": null},
    {"order_in_session": 3, "measurement_type_raw": "грудь", "value_numeric": 109.0, "unit": "cm", "raw_value": "109 см", "notes": null},
    {"order_in_session": 4, "measurement_type_raw": "талия", "value_numeric": 93.8, "unit": "cm", "raw_value": "93.8 см", "notes": null},
    {"order_in_session": 5, "measurement_type_raw": "бедра", "value_numeric": 101.8, "unit": "cm", "raw_value": "101.8 см", "notes": null},
    {"order_in_session": 6, "measurement_type_raw": "бедро", "value_numeric": 61.8, "unit": "cm", "raw_value": "61.8 см", "notes": null},
    {"order_in_session": 7, "measurement_type_raw": "икра", "value_numeric": 39.5, "unit": "cm", "raw_value": "39.5 см", "notes": null},
    {"order_in_session": 8, "measurement_type_raw": "бицепс", "value_numeric": 37.5, "unit": "cm", "raw_value": "37.5 см", "notes": null},
    {"order_in_session": 9, "measurement_type_raw": "предплечье", "value_numeric": 30.9, "unit": "cm", "raw_value": "30.9 см", "notes": null},
    {"order_in_session": 10, "measurement_type_raw": "вес", "value_numeric": 93.2, "raw_value": "93.2 кг", "notes": "Unit intentionally omitted to test defaulting."}
  ]
}
